num,image_url,suggestions,gtrans
0,https://i.imgur.com/hFrSNcQ.png,{},"pfeife tick bzzzt ding glorp pop splat glockenspiel blasen puff"
1,https://i.imgur.com/Gy3SsKW.png,{},"klingeln blase signalton thud knistern rauschen zischen pffft surren"
2,https://i.imgur.com/lbb18fk.png,{'Charms': 'Zaubersprüche'},"professor flitwick hatte harry während des zauberunterrichts an diesem montag schweigend ein gefaltetes pergament gereicht und der zettel hatte gesagt dass harry den schulleiter nach belieben besuchen sollte und auf eine weise dass es niemand sonst bemerken würde besonders nicht draco malfoy oder professor quirrell"
3,https://i.imgur.com/XT6MKey.png,{},"sein einmaliges passwort für den wasserspeier wäre zimperliches knochenbrech"
4,https://i.imgur.com/EjQaUim.png,{},"dies war von einer bemerkenswert künstlerischen tuschezeichnung begleitet worden in der professor flitwick ihn streng anstarrte dessen augen gelegentlich blinzelten und am ende der notiz dreimal unterstrichen stand der satz don t get into trouble"
5,https://i.imgur.com/jObK3UB.png,{'Transfiguration': 'Verwandlung'},"und so hatte harry den verwandlungskurs beendet und mit hermine gelernt zu abend gegessen und mit seinen leutnants gesprochen und schließlich als die uhr neun schlug sich unsichtbar gemacht und sich auf 18 uhr zurückgeworfen und müde zum wasserspeier trottete wendeltreppe die holztür der raum voller kleiner fummelei und die silberbärtige gestalt des schulleiters"
6,https://i.imgur.com/g7MkCbE.png,{},"dieses mal sah dumbledore ziemlich ernst aus das übliche lächeln fehlte und er trug einen pyjama in einem dunkleren und nüchterneren purpur als üblich"
7,https://i.imgur.com/MCfyAQ3.png,{},"danke dass du gekommen bist harry sagte der schulleiter"
8,https://i.imgur.com/kcz73yR.png,{},"der alte zauberer erhob sich von seinem thron begann langsam durch den raum und die fremden geräte zu gehen"
9,https://i.imgur.com/DtXZmkK.png,{},"zuerst hast du die notizen der gestrigen begegnung mit lucius malfoy bei dir"
10,https://i.imgur.com/PbT6YkZ.png,{},"anmerkungen platzte harry heraus"
11,https://i.imgur.com/cEst3Si.png,{},"du hast es doch bestimmt aufgeschrieben sagte der alte zauberer und seine stimme verstummte"
12,https://i.imgur.com/La7vHPc.png,{},"harry war ziemlich verlegen"
13,https://i.imgur.com/iJ2iYhQ.png,{},"ja wenn du gerade ein mysteriöses gespräch voller bedeutsamer hinweise durchforstet hättest die du nicht verstehst wäre es verdammt naheliegend alles sofort danach aufzuschreiben bevor die erinnerung verblasst damit du versuchen könntest es herauszufinden später heraus"
14,https://i.imgur.com/SvUQ0fs.png,{},"also gut sagte der schulleiter dann aus dem gedächtnis"
15,https://i.imgur.com/K6s6np0.png,{},"harry rezitierte verlegen so gut er konnte und hatte fast die hälfte geschafft bevor er erkannte dass es nicht schlau war dem möglicherweise verrückten schulleiter einfach alles zu erzählen zumindest nicht ohne vorher darüber nachzudenken aber dann war lucius definitiv ein schlechter kerl und dumbledores gegner also war es wahrscheinlich eine gute idee es ihm zu sagen und harry hatte bereits angefangen zu reden und es war zu spät um die dinge jetzt auszurechnen"
16,https://i.imgur.com/j3lRWyH.png,{},"harry beendete seine erinnerungen ehrlich"
17,https://i.imgur.com/zwF5pII.png,{},"dumbledores gesicht war distanzierter geworden als harry fortfuhr und am ende lag ein ausdruck von alter um ihn eine strenge in der luft"
18,https://i.imgur.com/urnzUpa.png,{},"nun sagte dumbledore dann schlage ich vor dass du gut aufpasst dass der erbe von malfoy nicht zu schaden kommt und ich werde dasselbe tun"
19,https://i.imgur.com/FuqrZZU.png,{},"der schulleiter runzelte die stirn seine finger trommelten lautlos durch die tintenschwarze oberfläche eines tellers auf dem das wort leliel stand"
20,https://i.imgur.com/nma09E2.png,{},"und ich denke es wäre äußerst weise für dich von nun an jegliche interaktion mit lord malfoy zu vermeiden"
21,https://i.imgur.com/sF8CcAW.png,{},"hast du eulen von ihm zu mir abgefangen sagte harry"
22,https://i.imgur.com/Wimwp0r.png,{},"der schulleiter starrte harry einen langen moment an dann nickte er widerstrebend"
23,https://i.imgur.com/o57yaLB.png,{},"aus irgendeinem grund war harry nicht so empört wie er hätte sein sollen"
24,https://i.imgur.com/efkfr2D.png,{},"vielleicht war es nur so dass es harry gerade sehr leicht fiel mit dem standpunkt des schulleiters zu sympathisieren"
25,https://i.imgur.com/Z3wSPq6.png,{},"sogar harry konnte verstehen warum dumbledore nicht wollte dass er mit lucius malfoy interagierte es schien keine böse tat zu sein"
26,https://i.imgur.com/aWHF996.png,{},"nicht wie der schulleiter der zabini erpresst wofür sie nur zabinis wort hatten und zabini war absolut nicht vertrauenswürdig"
27,https://i.imgur.com/4B2hWXw.png,{},"wie wäre es wenn ich anstatt zu protestieren sage dass ich deinen standpunkt verstehe sagte harry und du weiterhin meine eulen abfangst mir aber sagst von wem"
28,https://i.imgur.com/KBTjtry.png,{},"ich habe sehr viele eulen für dich abgefangen fürchte ich sagte dumbledore nüchtern"
29,https://i.imgur.com/hz5quJk.png,{},"du bist eine berühmtheit harry und du würdest jeden tag dutzende von briefen erhalten einige von weit außerhalb dieses landes hätte ich sie nicht zurückgeschickt"
30,https://i.imgur.com/1ZTRESF.png,{},"das sagte harry der jetzt ein wenig empörung zu spüren begann scheint ein bisschen zu weit zu gehen"
31,https://i.imgur.com/XlJ9m9J.png,{},"viele dieser briefe sagte der alte zauberer leise werden dich um dinge bitten die du nicht geben kannst"
32,https://i.imgur.com/fjdEwM0.png,{},"ich habe sie natürlich nicht gelesen sondern nur unzustellbar an ihre absender zurückgeschickt"
33,https://i.imgur.com/AVrm75e.png,{},"aber ich weiß es denn ich empfange sie auch"
34,https://i.imgur.com/aPqwgm7.png,{},"und du bist zu jung harry um dir jeden morgen vor dem frühstück sechs mal das herz brechen zu lassen"
35,https://i.imgur.com/NY8uAA5.png,{},"harry sah auf seine schuhe hinunter"
36,https://i.imgur.com/1NZ9oX3.png,{},"er sollte darauf bestehen die briefe zu lesen und selbst zu urteilen aber da war eine leise stimme des gesunden menschenverstandes in ihm und sie schrie gerade sehr laut"
37,https://i.imgur.com/0CWFssw.png,{},"danke murmelte harry"
38,https://i.imgur.com/fR6Tb77.png,{},"der andere grund warum ich sie hierher gebeten habe sagte der alte zauberer war dass ich ihr einzigartiges genie konsultieren wollte"
39,https://i.imgur.com/L2ZU6yb.png,{'Transfiguration': 'Verwandlung'},"verklärung sagte harry überrascht und geschmeichelt"
40,https://i.imgur.com/wzLCe8P.png,{},"nein nicht dieses einzigartige genie sagte dumbledore"
41,https://i.imgur.com/LybNz2Q.png,"{'Dementor': 'Dementor', 'Hogwarts': 'Hogwarts'}","sag mir harry was könntest du böses anrichten wenn ein dementor das gelände von hogwarts betreten dürfte"
42,https://i.imgur.com/YXoS1LH.png,"{'Dementor': 'Dementor', 'Patronus': 'Patronus'}","es stellte sich heraus dass professor quirrell seine schüler gebeten oder vielmehr verlangt hatte ihre fähigkeiten gegen einen echten dementor zu testen nachdem sie die worte und gesten des patronuszaubers gelernt hatten"
43,https://i.imgur.com/WkHVcV8.png,{'Patronus': 'Patronus'},"professor quirrell ist nicht in der lage den patronuszauber selbst zu wirken sagte dumbledore während er langsam durch die geräte ging"
44,https://i.imgur.com/uQs5HuU.png,{},"was nie ein gutes zeichen ist"
45,https://i.imgur.com/2bqSQMT.png,{'Patronus': 'Patronus'},"aber dann teilte er mir diese tatsache mit als er verlangte dass externe lehrer hinzugezogen werden um jedem schüler der lernen wollte den patronus-zauber beizubringen er bot an die kosten selbst zu bezahlen wenn ich nicht wollte"
46,https://i.imgur.com/4iqXMgb.png,{},"dies hat mich sehr beeindruckt"
47,https://i.imgur.com/JiPW8wS.png,{'Dementor': 'Dementor'},"aber jetzt besteht er darauf einen dementor zu holen"
48,https://i.imgur.com/qXNNfgR.png,{},"direktor sagte harry leise professor quirrell glaubt sehr stark an live-feuer-tests unter realistischen kampfbedingungen"
49,https://i.imgur.com/RvUkHTB.png,{'Dementor': 'Dementor'},"der wunsch einen echten dementor hereinzubringen ist für ihn völlig charakteristisch"
50,https://i.imgur.com/NTZhdtv.png,{},"jetzt warf der schulleiter harry einen seltsamen blick zu"
51,https://i.imgur.com/gsq4dJs.png,{},"im charakter sagte der alte zauberer"
52,https://i.imgur.com/mpl5iq0.png,{},"ich meine sagte harry es stimmt völlig mit der art und weise überein wie sich professor quirrell normalerweise verhält harry verstummte"
53,https://i.imgur.com/TnCy9Iz.png,{},"warum hatte er es so formuliert"
54,https://i.imgur.com/5EoWrEP.png,{},"der schulleiter nickte"
55,https://i.imgur.com/BV3YwHw.png,{},"sie haben also das gleiche gefühl wie ich dass es eine entschuldigung ist"
56,https://i.imgur.com/Ay8gemf.png,{},"eine sehr vernünftige entschuldigung um sicher zu sein mehr als sie vielleicht denken"
57,https://i.imgur.com/tFIwVPO.png,"{'Dementor': 'Dementor', 'Patronus': 'Patronus'}","zauberer die anscheinend nicht in der lage sind einen patronuszauber zu wirken werden in der gegenwart eines echten dementors erfolgreich sein und von keinem einzigen lichtblitz zu einem vollen körperlichen patronus übergehen"
58,https://i.imgur.com/mYrmO6Z.png,{},"warum das so sein sollte weiß niemand aber es ist so"
59,https://i.imgur.com/Hheqjuf.png,{},"harry runzelte die stirn"
60,https://i.imgur.com/GQqTmew.png,{},"dann verstehe ich wirklich nicht warum du misstrauisch bist"
61,https://i.imgur.com/SKlFtVY.png,{},"der schulleiter breitete seine hände aus als ob er hilflos wäre"
62,https://i.imgur.com/OmK4cNE.png,{'Hogwarts': 'Hogwarts'},"harry der verteidigungsprofessor hat mich gebeten die dunkelste aller kreaturen durch die tore von hogwarts zu passieren"
63,https://i.imgur.com/pZ72p4o.png,{},"ich muss misstrauisch sein"
64,https://i.imgur.com/xJVfJO9.png,{},"der schulleiter seufzte"
65,https://i.imgur.com/pRGQRAf.png,{'Dementor': 'Dementor'},"und doch wird der dementor in einem mächtigen käfig bewacht bewacht ich werde immer selbst da sein um ihn zu beobachten - ich kann mir nicht vorstellen was böses getan werden könnte"
66,https://i.imgur.com/0suFNf2.png,{},"aber vielleicht kann ich es auch nur nicht sehen"
67,https://i.imgur.com/bZu8wwk.png,{},"und deshalb frage ich sie"
68,https://i.imgur.com/cpb4Y8x.png,{},"harry starrte den schulleiter mit offenem mund an"
69,https://i.imgur.com/glnqXmk.png,{},"er war so schockiert dass er sich nicht einmal geschmeichelt fühlen konnte"
70,https://i.imgur.com/UYFeU45.png,{},"mich sagte harry"
71,https://i.imgur.com/4sYGaUq.png,{},"ja sagte dumbledore und lächelte leicht"
72,https://i.imgur.com/Hamr9IF.png,{},"ich versuche mein bestes um meine feinde zu antizipieren ihre bösen gedanken zu erfassen und ihre bösen gedanken vorherzusagen"
73,https://i.imgur.com/waFUhal.png,{'Hufflepuff': 'Hufflepuff'},"aber ich hätte mir nie vorstellen können die knochen eines hufflepuffs zu waffen zu schärfen"
74,https://i.imgur.com/RuLDlqI.png,{},"würde harry das jemals aushalten"
75,https://i.imgur.com/w4Ww0Zq.png,{},"schulleiter sagte harry müde ich weiß es klingt nicht gut aber im ernst ich bin nicht böse ich bin nur sehr kreativ"
76,https://i.imgur.com/QOpCfsp.png,{},"ich habe nicht gesagt dass du böse bist sagte dumbledore ernst"
77,https://i.imgur.com/wBgNcT7.png,{},"es gibt leute die sagen das böse zu begreifen bedeutet böse zu werden aber sie geben nur vor weise zu sein"
78,https://i.imgur.com/WMg7fuV.png,{},"vielmehr ist es das böse das die liebe nicht kennt und sich die liebe nicht vorzustellen wagt und die liebe niemals verstehen kann ohne aufzuhören böse zu sein"
79,https://i.imgur.com/StxkCbV.png,{},"und ich vermute dass du dir deinen weg in die köpfe von dark wizards besser vorstellen kannst als ich es jemals könnte während du immer noch weißt dass du dich selbst liebst"
80,https://i.imgur.com/6C7USGk.png,"{'Dementor': 'Dementor', 'Hogwarts': 'Hogwarts'}","also harry die augen des schulleiters waren angespannt wenn sie in professor quirrells schuhen stünden welche untaten könnten sie begehen nachdem sie mich dazu gebracht haben einen dementor auf das gelände von hogwarts zu lassen"
81,https://i.imgur.com/vCvbYJe.png,{},"warte sagte harry und trottete leicht benommen zu dem stuhl vor dem schreibtisch des schulleiters und setzte sich"
82,https://i.imgur.com/Oe5Qbpa.png,{},"diesmal war es ein großer und bequemer stuhl kein hölzerner hocker und harry konnte fühlen wie er eingehüllt wurde als er darin sank"
83,https://i.imgur.com/Nuu17pD.png,{},"dumbledore bat ihn professor quirrell zu überlisten"
84,https://i.imgur.com/rDeV29L.png,{},"punkt eins harry mochte professor quirrell eher als dumbledore"
85,https://i.imgur.com/PEHOVwr.png,{},"punkt zwei die hypothese war dass der verteidigungsprofessor vorhatte etwas böses zu tun und in diesem konjunktiv-fall sollte harry dem schulleiter helfen dies zu verhindern"
86,https://i.imgur.com/VZd7C7d.png,{},"punkt drei"
87,https://i.imgur.com/k4x5Yk8.png,{},"direktor sagte harry wenn professor quirrell etwas vorhat bin ich mir nicht sicher ob ich ihn überlisten kann"
88,https://i.imgur.com/VEJDzVl.png,{},"er hat viel mehr erfahrung als ich"
89,https://i.imgur.com/sgl4nN9.png,{},"der alte zauberer schüttelte den kopf und schaffte es irgendwie trotz seines lächelns sehr feierlich zu erscheinen"
90,https://i.imgur.com/23eDdby.png,{},"sie unterschätzen sich selbst"
91,https://i.imgur.com/WtrkpRb.png,{},"das war das erste mal dass jemand das zu harry gesagt hatte"
92,https://i.imgur.com/rstvWre.png,{'Slytherin': 'Slytherin'},"ich erinnere mich fuhr der alte zauberer fort ein junger mann in genau diesem büro kalt und kontrolliert als er dem hauslehrer slytherin gegenüberstand und seinen eigenen schulleiter erpresste um seine klassenkameraden zu schützen"
93,https://i.imgur.com/V3F8mL7.png,{},"und ich glaube dass dieser junge mann schlauer ist als professor quirrell schlauer als lucius malfoy dass er voldemort selbst ebenbürtig werden wird"
94,https://i.imgur.com/gNZivJU.png,{},"er ist es den ich konsultieren möchte"
95,https://i.imgur.com/DhUAFZ4.png,{},"harry unterdrückte die kälte die ihn bei dem namen durchfuhr und sah den schulleiter nachdenklich an"
96,https://i.imgur.com/nyJmSIQ.png,{},"wie viel weiß er"
97,https://i.imgur.com/9CELGO0.png,{},"der schulleiter hatte harry im griff seiner mysteriösen dunklen seite gesehen so tief wie harry jemals darin versunken war"
98,https://i.imgur.com/m6SkQjq.png,{},"harry erinnerte sich noch immer daran wie es gewesen war unsichtbar der zeitumkehrung zuzusehen wie sein vergangenes ich den älteren slytherins gegenüberstand der junge mit der narbe auf der stirn der sich nicht wie die anderen benahm"
99,https://i.imgur.com/Y0gKZCE.png,{},"natürlich wäre dem schulleiter etwas seltsames an dem jungen in seinem büro aufgefallen"
100,https://i.imgur.com/NzBl7yZ.png,{'Dark Lord': 'Dunkler Lord'},"und dumbledore war zu dem schluss gekommen dass sein lieblingsheld gerissen war um seinem bestimmten feind dem dunklen lord gerecht zu werden"
101,https://i.imgur.com/bAcNHF8.png,{'Dark Lord': 'Dunkler Lord'},"was nicht viel verlangte wenn man bedenkt dass der dunkle lord ein deutlich sichtbares dunkles mal auf alle linken arme seiner diener gelegt hatte und dass er das gesamte kloster abgeschlachtet hatte das die kampfkunst lehrte die er lernen wollte"
102,https://i.imgur.com/d3uuXDa.png,{},"genug list um es mit professor quirrell aufzunehmen wäre ein ganz anderes problem"
103,https://i.imgur.com/eSA3KiS.png,{},"aber es war auch klar dass der schulleiter nicht zufrieden sein würde bis harry ganz kalt und dunkel wurde und eine art antwort fand die beeindruckend schlau klang"
104,https://i.imgur.com/FUrvb2S.png,{},"und natürlich würde harry zu seiner dunklen seite hinübergehen und es aus dieser richtung durchdenken nur um ehrlich zu sein und nur für den fall"
105,https://i.imgur.com/cvWlrD3.png,{'Dementor': 'Dementor'},"erzähl mir sagte harry alles darüber wie der dementor hereingebracht und bewacht werden soll"
106,https://i.imgur.com/hrVlPhx.png,{},"dumbledores augenbrauen hoben sich für einen moment und dann begann der alte zauberer zu sprechen"
107,https://i.imgur.com/ib1wNoW.png,"{'Auror': 'Auror', 'Dementor': 'Dementor', 'Hogwarts': 'Hogwarts', 'Patronus': 'Patronus'}","der dementor würde von einem auroren-trio auf das gelände von hogwarts gebracht alle drei waren dem schulleiter persönlich bekannt und alle drei waren in der lage einen körperlichen patronuszauber zu wirken"
108,https://i.imgur.com/IHLr54v.png,"{'Dementor': 'Dementor', 'Hogwarts': 'Hogwarts'}","sie würden am rand des geländes von dumbledore abgeholt werden der den dementor durch die hogwarts-stationen führen würde -"
109,https://i.imgur.com/NjcPH3w.png,{'Dementor': 'Dementor'},"harry fragte ob der pass dauerhaft oder vorübergehend sei ob jemand den gleichen dementor am nächsten tag einfach noch einmal hereinbringen könnte"
110,https://i.imgur.com/I7ajeYM.png,{'Dementor': 'Dementor'},"der pass war vorübergehend erwiderte der schulleiter mit einem zustimmenden nicken und die erklärung ging weiter der dementor würde in einem käfig aus massiven titanstangen sein nicht verklärt sondern echt geschmiedet mit der zeit würde die anwesenheit eines dementors dieses metall zu staub zersetzen aber nicht an einem einzigen tag"
111,https://i.imgur.com/odImC82.png,{'Dementor': 'Dementor'},"schüler die darauf warteten an der reihe zu sein würden sich weit hinter dem dementor aufhalten hinter zwei körperlichen patronus die von zwei der drei auroren zu jeder zeit unterhalten wurden"
112,https://i.imgur.com/7UmqNwS.png,"{'Dementor': 'Dementor', 'Patronus': 'Patronus'}","dumbledore würde mit seinem patronus am käfig des dementors warten"
113,https://i.imgur.com/Apxh3vg.png,"{'Dementor': 'Dementor', 'Patronus': 'Patronus'}","ein einzelner schüler würde sich dem dementor nähern und dumbledore würde seinen patronus vertreiben und der schüler würde versuchen seinen eigenen patronuszauber zu wirken und wenn sie scheiterten würde dumbledore seinen patronus wiederherstellen bevor der schüler dauerhaften schaden erleiden konnte"
114,https://i.imgur.com/KBBY3rB.png,{},"der frühere duellmeister professor flitwick würde auch anwesend sein während studenten in der nähe waren nur um die sicherheitsmarge zu erhöhen"
115,https://i.imgur.com/SSxsMzf.png,{'Dementor': 'Dementor'},"warum wartest du nur beim dementor sagte harry"
116,https://i.imgur.com/EN1E8cY.png,{'Auror': 'Auror'},"ich meine solltest du es nicht sein und ein auror"
117,https://i.imgur.com/g7dNotk.png,{},"der schulleiter schüttelte den kopf"
118,https://i.imgur.com/FCYB7P7.png,"{'Dementor': 'Dementor', 'Patronus': 'Patronus'}","sie konnten der wiederholten exposition gegenüber dem dementor nicht standhalten jedes mal wenn ich meinen patronus zerstreue"
119,https://i.imgur.com/MTXQZFQ.png,"{'Auror': 'Auror', 'Dementor': 'Dementor', 'Patronus': 'Patronus'}","und wenn dumbledores patronus aus irgendeinem grund versagte während einer der schüler noch in der nähe des dementors war würde der dritte auror einen anderen körperlichen patronus wirken und ihn senden um den schüler zu schützen"
120,https://i.imgur.com/GhNPnMe.png,{},"harry stocherte und stupste aber er konnte keinen fehler in der sicherheit erkennen"
121,https://i.imgur.com/wFNdWPG.png,{},"also holte harry tief luft sank weiter in den stuhl schloss die augen und erinnerte sich"
122,https://i.imgur.com/OKdhO5m.png,{},"und das werden fünf punkte sein"
123,https://i.imgur.com/HCVJ0BY.png,{'Ravenclaw': 'Ravenclaw'},"nein lassen sie uns aus ravenclaw gerade einmal zehn punkte für das backchat machen"
124,https://i.imgur.com/mxLGVvQ.png,{},"die kälte kam jetzt langsamer widerwilliger harry hatte in letzter zeit nicht viel nach seiner dunklen seite gerufen"
125,https://i.imgur.com/eiCB5QT.png,{'Potions': 'Zaubertränke'},"harry musste die gesamte sitzung in zaubertränke in gedanken durchgehen bevor sein blut zu etwas kühlte das sich tödlicher kristalliner klarheit annäherte"
126,https://i.imgur.com/DKX26kB.png,{'Dementor': 'Dementor'},"und dann dachte er an den dementor"
127,https://i.imgur.com/KTmMSZR.png,{},"und es war offensichtlich"
128,https://i.imgur.com/HzpH3ga.png,{'Dementor': 'Dementor'},"der dementor ist eine ablenkung sagte harry"
129,https://i.imgur.com/oJF4PyI.png,{},"die kälte war klar in seiner stimme denn das war es was dumbledore wollte und erwartete"
130,https://i.imgur.com/OV7MSsN.png,{},"eine große markante bedrohung aber am ende unkompliziert und leicht zu verteidigen"
131,https://i.imgur.com/NVAnWrB.png,{'Dementor': 'Dementor'},"während also ihre ganze aufmerksamkeit auf den dementor gerichtet ist wird die eigentliche handlung woanders stattfinden"
132,https://i.imgur.com/HtgRMfi.png,{},"dumbledore starrte harry einen moment lang an und nickte dann langsam"
133,https://i.imgur.com/ADGCiPs.png,{},"ja sagte der schulleiter"
134,https://i.imgur.com/n2ESrfo.png,{},"und ich glaube ich weiß wovon es ablenken könnte wenn professor quirrell schlecht meint danke harry"
135,https://i.imgur.com/BC8BIej.png,{},"der schulleiter starrte harry immer noch an ein seltsamer ausdruck in diesen alten augen"
136,https://i.imgur.com/TNvlDuq.png,{},"was sagte harry mit einem anflug von verärgerung die kälte lag noch immer in seinem blut"
137,https://i.imgur.com/g6DcBSi.png,{},"ich habe noch eine frage an diesen jungen mann sagte der schulleiter"
138,https://i.imgur.com/JaIzLo2.png,{},"es ist etwas das ich mir schon lange gefragt habe aber nicht begreifen konnte warum"
139,https://i.imgur.com/HKE4htT.png,{},"in seiner stimme lag ein anflug von schmerz"
140,https://i.imgur.com/Ungepc9.png,{},"warum sollte sich jemand absichtlich zu einem monster machen"
141,https://i.imgur.com/Wap6XZi.png,{},"warum böses tun um des bösen willen"
142,https://i.imgur.com/WfiUkDw.png,{},"warum voldemort"
143,https://i.imgur.com/3v8lNK2.png,{},"surren bzzzt ticken ding puff splat"
144,https://i.imgur.com/YKkFbsG.png,{},"harry starrte den schulleiter überrascht an"
145,https://i.imgur.com/U3f6t0J.png,{},"woher soll ich das wissen sagte harry"
146,https://i.imgur.com/sfZfs4B.png,{'Dark Lord': 'Dunkler Lord'},"soll ich den dunklen lord magisch verstehen weil ich der held bin oder so"
147,https://i.imgur.com/tzCdtPo.png,{},"jawohl sagte dumbledore"
148,https://i.imgur.com/TbJrN6s.png,{'Grindelwald': 'Grindelwald'},"mein eigener großer feind war grindelwald und ich verstand ihn wirklich sehr gut"
149,https://i.imgur.com/8sg0Gpa.png,{'Grindelwald': 'Grindelwald'},"grindelwald war mein dunkler spiegel der mann der ich so leicht hätte sein können wenn ich der versuchung nachgegeben hätte zu glauben ich sei ein guter mensch und daher immer im recht"
150,https://i.imgur.com/nwDuXOL.png,{},"zum wohle der allgemeinheit das war sein slogan und er glaubte es selbst wahrhaftig während er ganz europa wie ein verwundetes tier zerriss"
151,https://i.imgur.com/3f9OUJ4.png,{},"und ihn habe ich am ende besiegt"
152,https://i.imgur.com/SghmYeA.png,{},"aber dann kam voldemort nach ihm um alles zu zerstören was ich in großbritannien beschützt hatte"
153,https://i.imgur.com/eAAQ4Yc.png,{},"der schmerz war jetzt deutlich in dumbledores stimme enthüllt auf seinem gesicht"
154,https://i.imgur.com/d0LjzJ9.png,{'Grindelwald': 'Grindelwald'},"er hat weit schlimmere taten begangen als grindelwalds schlimmste horror um des horrors willen"
155,https://i.imgur.com/yYJ0wwp.png,{},"ich habe alles geopfert nur um ihn zurückzuhalten und ich verstehe immer noch nicht warum"
156,https://i.imgur.com/5bzI6MO.png,{},"warum harry"
157,https://i.imgur.com/IqWI4SX.png,{},"warum hat er das getan"
158,https://i.imgur.com/QIbqKXA.png,{},"er war nie mein bestimmter feind aber deiner also wenn du irgendwelche vermutungen hast harry dann sag es mir bitte warum"
159,https://i.imgur.com/rkdMrzo.png,{},"harry starrte auf seine hände hinunter"
160,https://i.imgur.com/qpxn1Sk.png,{'Dark Lord': 'Dunkler Lord'},"die wahrheit war dass harry den dunklen lord noch nicht gelesen hatte und im moment hatte er nicht die geringste ahnung"
161,https://i.imgur.com/1jkpe2t.png,{},"und irgendwie schien das keine antwort zu sein die der schulleiter hören wollte"
162,https://i.imgur.com/UT67qY3.png,{},"vielleicht zu viele dunkle rituale"
163,https://i.imgur.com/O4rHib7.png,{},"am anfang dachte er er würde nur eines tun aber es opferte einen teil seiner guten seite und das machte ihn weniger zurückhaltend andere dark-rituale durchzuführen also führte er immer mehr rituale in einem positiven feedback-zyklus durch bis er schließlich als ein ungeheuer mächtiges monster -"
164,https://i.imgur.com/aTqGScB.png,{},"nein jetzt war die stimme des schulleiters gequält das kann ich nicht glauben harry"
165,https://i.imgur.com/wlPL0r9.png,{},"da muss noch etwas mehr drin sein"
166,https://i.imgur.com/52zwfVg.png,{},"warum sollte es sein dachte harry aber er sagte es nicht denn es war klar dass der schulleiter dachte das universum sei eine geschichte und eine handlung und dass große tragödien nur aus ebenso großen bedeutsamen gründen passieren durften"
167,https://i.imgur.com/YbhrWNz.png,{},"es tut mir leid schulleiter"
168,https://i.imgur.com/9QenrBt.png,"{'The Dark Lord': 'Dunkle Lord, Der', 'Dark Lord': 'Dunkler Lord'}","der dunkle lord kommt mir nicht wie ein dunkler spiegel vor überhaupt nicht"
169,https://i.imgur.com/P7RgpLY.png,{},"es gibt nichts was ich auch nur im geringsten verlockend finde die häute von yermy wibbles familie an eine redaktionswand zu nageln"
170,https://i.imgur.com/TJQtTIt.png,{},"haben sie keine weisheit zu teilen sagte dumbledore"
