Input.num,Translation
379,Das Gesicht des alten Zauberers war angespannt vor Wut und Sorge.
380,",,Voldemort stahl das Buch, durch welches er das Geheimnis herausbekam; als ich danach suchte war es nicht dort."
380,"""Voldemort hat das Buch gestohlen, aus dem er sein Geheimnis entnommen hat; es war nicht mehr da, als ich danach suchte."
383,"""Nun ja, offensichtlich werde ich keine Unsterblichkeitsmethode verbreiten, welche das Töten von Menschen voraussetzt!"
383,"""Natürlich werde ich keine Unsterblichkeitsmethode propagieren, die das Töten von Menschen erfordert!"
387,"""Du würdest keinen Ritual nehmen, der Menschenopferung braucht."""
387,"""Sie würden kein Ritual anwenden, das Menschenopfer erfordert."""
390,"Du bist derjenige, der denkt, der Tod sei beeindruckend und dass jederman sterben sollte!"""
390,"Du bist derjenige, der denkt, dass der Tod großartig ist und dass jeder sterben sollte!"""
391,"""Ich weiß nicht mehr weiter, Harry"", sagte der alte Zauberer."
391,"""Ich bin ratlos, Harry"", sagte der alte Zauberer."
392,"Seine Füße begannen nun wieder, sein kurioses Büro zu durchschreiten."
392,Seine Füße stapften wieder durch sein seltsames Büro.
393,"Ich habe keine Ahnung, was ich sagen soll"
393,"""Ich weiß nicht, was ich sagen soll."""
395,",,Dass ich von dir so falsch verstanden werde..."
395,"""Nur, dass ich von Ihnen sehr missverstanden werde..."
397,",,Du willst einfach nicht, dass irgendwer unsterblich ist"", sagte Harry mit merkbarer Ironie."
397,"""Du willst nur nicht, dass jemand unsterblich ist"", sagte Harry mit viel Ironie."
399,Der alte Zauberer nickte.
399,Der alte Zauberer nickte.
400,"""Ich habe nicht mehr dieselbe Angst wie vorher, jedoch bin ich immer noch sehr besorgt um dich, Harry"", sagte er leise."
400,"""Ich habe weniger Angst als früher, aber ich mache mir immer noch große Sorgen um dich, Harry"", sagte er leise."
401,"Seine Hand, ein wenig runzlig vom Zeichen der Zeit und doch noch stark, platzierte die Kristallkugel wieder fest in ihrem Halter."
401,"Seine von der Zeit etwas geschwächte, aber immer noch kräftige Hand legte die Kristallkugel fest in ihren Ständer zurück."
402,"""Denn die Angst vor dem Tod ist eine bittere Sache, eine Krankheit der Seele, durch die Menschen verdreht und verformt werden."
402,"""Denn die Angst vor dem Tod ist eine bittere Sache, eine Krankheit der Seele, die den Menschen verdreht und entstellt."
405,"Sagte Harry, ohne überhaupt den Versuch zu begehen, die Ungläubigkeit in seiner Stimme zu überspielen."
405,"sagte Harry und versuchte nicht einmal, die Ungläubigkeit in seiner Stimme zu verbergen."
406,Das Gesicht des alten Zauberers war friedvoll.
406,Das Gesicht des alten Zauberers war friedlich.
407,",,Ich bin nicht perfekt, Harry, aber ich glaube, ich habe den Tod als einen Teil von mir selbst akzeptiert."""
407,"""Ich bin nicht perfekt, Harry, aber ich glaube, ich habe meinen Tod als Teil von mir akzeptiert."""
408,",,Aha"", sagte Harry."
408,"""Ja"", sagte Harry."
409,"""Es gibt diese Kleinigkeit namens kognitive Dissonanz oder einfacher formuliert: saure Weintrauben."
409,"""Sehen Sie, es gibt da diese kleine Sache, die man kognitive Dissonanz nennt, oder einfacher ausgedrückt: saure Trauben."
411,"Wie zum Beispiel, dass es dich härter macht oder du an den Tagen, an denen du nicht geschlagen wirst, glücklicher bist."
411,"Zum Beispiel macht es dich härter, oder es macht dich glücklicher an den Tagen, an denen du nicht mit einem Knüppel geschlagen wirst."
414,"Wieso also sollte irgendjemand auch nur im Entferntesten etwas so Albernes denken, wie, dass der Tod etwas Gutes sein könnte?"
414,"Warum also sollte irgendjemand auf den dummen Gedanken kommen, dass der Tod eine gute Sache ist?"
416,"""Nein Harry"" der alte zauberer sagte."
416,"""Nein, Harry"", sagte der alte Zauberer."
420,", sagte Harry mit fester und grimmiger Stimme."
420,"sagte Harry, seine Stimme war nun hart und grimmig."
422,Du nahmst das fürchterlichste alles Bösens und nanntest es gut!
422,Du hast das schlimmste aller Übel genommen und es gut genannt!
423,Mit nur ein bisschen Nachhilfe könnte dieser selbe Teil von dir Unschuldige ermorden und es als Freundschaft bezeichnen.
423,Mit einer leichten Drehung würde derselbe Teil von dir Unschuldige ermorden und es Freundschaft nennen.
424,"Wenn du den Tod besser als das Leben nennst, dann kannst du deinen moralischen Kompass in jede Richtung drehen -"""
424,"Wenn man den Tod besser als das Leben nennen kann, dann kann man seinen moralischen Kompass so verdrehen, dass er überall hinzeigt -"""
428,Der alte Zauberer lächelte nun und ein ein leichtes Lachen war in seiner Stimme zu hören.
428,"Der alte Zauberer lächelte jetzt, und in seiner Stimme lag ein leises Lachen."
434,"Du bist so alt und weise und dennoch kannst du nichts von dem, was ich sage, auch nur zur Kenntnis nehmen! Nicht Verstehen, zur Kenntnis Nehmen!?"""
434,"Du bist so alt und weise, dass du nicht einmal etwas von dem, was ich sage, mitbekommst! Nicht verstehen, merken!?"""
438,Harry konnte sich fast nicht davon zurückhalten es laut zu sagen.
438,"Harry konnte sich gerade noch zurückhalten, es laut auszusprechen."
440,",,Nun werde ich deine ursprüngliche Frage beantworten."
440,"""Dann werde ich Ihre ursprüngliche Frage beantworten."
447,"Denn das ist, was der Tod wirklich ist - die Vernichtung der Seele!"""
447,"Denn das ist es, was der Tod wirklich ist - die Auslöschung einer Seele!"""
449,",,Ich denke ich verstehe nun"", sagte er ruhig."
449,"""Ich glaube, ich verstehe jetzt"", sagte er leise."
450,",,Oh?"" sagte Harry. ,,Was verstehst du?"""
450,"""Oh?"", sagte Harry. ""Was verstehen?"""
451,",,Voldemort"", sagte der alte Zauberer."
451,"""Voldemort"", sagte der alte Zauberer."
454,"Ich habe dich gefragt, warum er zu einem Monster wurde und du konntest mir keinen Grund sagen."
454,"Ich habe Sie gefragt, warum er ein Monster geworden ist, und Sie konnten keinen Grund nennen."
457,",,Verrate mir, Harry"", sagte der alte Zauberer, ,,wirst du zu einem Monster werden?"""
457,"""Sag mal, Harry"", sagte der alte Zauberer, ""willst du ein Monster werden?"""
458,",,nein"", sagte der Junge mit eiserner Gewissheit in der Stimme."
458,"""Nein"", sagte der Junge mit eiserner Gewissheit in seiner Stimme."
459,"""Wieso nicht?"", fragte der alte Zauberer."
459,"""Warum nicht?"", sagte der alte Zauberer."
461,"Das Universum ist weder bösartig, noch barmherzig, es ist einfach gleichgültig."
461,"Das Universum ist weder böse noch gut, es ist ihm einfach egal."
463,Aber das müssen sie nicht! Uns kümmert es!
463,Aber das müssen sie nicht! Wir kümmern uns!
464,In der Welt gibt es Licht und es ist auch in uns!?
464,"Es gibt Licht in der Welt, und das sind wir!"""
465,",,Ich frage mich, was aus dir werden wird, Harry,"" sagte der alte Zauberer."
465,"""Ich frage mich, was aus dir werden soll, Harry"", sagte der alte Zauberer."
